{
  "name": "Senior Ruby Developer",
  "refId": "SNR-Ruby-0431",
  "id": "a03fd159-8b1a-442e-b287-j9hd4280ad5b",
  "location": "Berlin, Germany",
  "department": "Engineering",
  "yearsOfXp": 3,
  "yearsRelevantXp": 3,
  "requiredTechnologies": ["Ruby"],
  "technologies": ["MySql"],
  "description": "You have to be a super rockstar with ruby 50+ years of experience."
}
